{
  "$schema": "./schema.json",
  "name": "dtrack",
  "description": "ART DTrack: body 0 on the glasses, Flystick 0 as the wand. Enable 6d and 6df2 output to this machine.",
  "manager": "ws://localhost:8765",
  "source": { "type": "dtrack", "port": 5000 },
  "calibration": { "units": "mm", "axes": ["x", "z", "-y"], "yaw": 0, "offset": [0, 0, 0] },
  "head": { "id": 0, "localOffset": [0, -0.02, -0.03] },
  "wand": {
    "id": "flystick 0",
    "buttons": { "0": "primary", "1": "secondary", "2": "tertiary", "3": "quaternary", "4": "menu", "5": "reset" },
    "axes": { "move": [0, 1] }
  }
}
